{
    "manifestVersion":  "0.1.0",
    "name":  "form-analysis-kit-suite",
    "displayName":  "Form Analysis Kit Suite",
    "sourceSystem":  {
                         "path":  "C:\\Users\\gslab\\Desktop\\Form-analysis-server-specify-kit",
                         "appRoot":  "form-analysis-server",
                         "frontendRoot":  "form-analysis-server/frontend",
                         "backendRoot":  "form-analysis-server/backend"
                     },
    "defaultDatabaseRecommendation":  {
                                          "engine":  "postgresql",
                                          "reason":  "This system stores formal operating records, import history, traceability data, user permissions, and background processing results. PostgreSQL is recommended for long-term storage, backup, and multi-user production use."
                                      },
    "kits":  [
                 {
                     "id":  "platform-core-kit",
                     "displayName":  "平台核心",
                     "category":  "foundation",
                     "required":  true,
                     "businessCapability":  "提供應用程式啟動、設定、資料庫連線、健康檢查、共用樣式、語系與 API 呼叫基礎。",
                     "dependencies":  [

                                      ],
                     "frontend":  {
                                      "pages":  [

                                                ],
                                      "components":  [

                                                     ],
                                      "services":  [
                                                       "frontend/src/services/fetchWrapper.ts",
                                                       "frontend/src/services/a11y.ts",
                                                       "frontend/src/services/kitClient.ts"
                                                   ],
                                      "shellFiles":  [
                                                         "frontend/src/App.tsx",
                                                         "frontend/src/main.tsx",
                                                         "frontend/src/i18n.ts",
                                                         "frontend/src/locales"
                                                     ]
                                  },
                     "backend":  {
                                     "routers":  [
                                                     "backend/app/api/routes_health.py",
                                                     "backend/app/api/routes_kit_broker.py",
                                                     "backend/app/api/routes_admin_permissions.py"
                                                 ],
                                     "core":  [
                                                  "backend/app/main.py",
                                                  "backend/app/core/config.py",
                                                  "backend/app/core/database.py",
                                                  "backend/app/core/logging.py",
                                                  "backend/app/core/middleware.py",
                                                  "backend/app/core/kit_contracts.py",
                                                  "backend/app/core/kit_broker.py",
                                                  "backend/app/core/db_capabilities.py",
                                                  "backend/app/core/permission_config.py",
                                                  "backend/app/core/endpoint_permission_middleware.py",
                                                  "backend/app/api/deps.py"
                                              ],
                                     "services":  [

                                                  ],
                                     "models":  [

                                                ],
                                     "routerRegistrations":  [
                                                                {
                                                                    "module":  "app.api.routes_health",
                                                                    "symbol":  "router",
                                                                    "prefix":  "/healthz",
                                                                    "tags":  [
                                                                                 "Health Check"
                                                                             ],
                                                                    "tenantScoped":  false
                                                                },
                                                                {
                                                                    "module":  "app.api.routes_kit_broker",
                                                                    "symbol":  "router",
                                                                    "prefix":  "/api/kit",
                                                                    "tags":  [
                                                                                 "Kit Broker"
                                                                             ],
                                                                    "tenantScoped":  false
                                                                },
                                                                {
                                                                    "module":  "app.api.routes_admin_permissions",
                                                                    "symbol":  "router",
                                                                    "prefix":  null,
                                                                    "tags":  [
                                                                                 "Admin"
                                                                             ],
                                                                    "tenantScoped":  false
                                                                }
                                                            ],
                                     "middlewareRegistrations":  [
                                                                     {
                                                                         "module":  "app.core.endpoint_permission_middleware",
                                                                         "symbol":  "endpoint_permission_middleware"
                                                                     }
                                                                 ]
                                 },
                     "database":  {
                                      "models":  [

                                                 ],
                                      "migrations":  [
                                                         "backend/alembic"
                                                     ]
                                  },
                     "preview":  {
                                     "supportsRealtimePreview":  true,
                                     "previewMode":  "app-shell"
                                 },
                     "subfeatures":  [
                                         {
                                             "id":  "app-shell",
                                             "displayName":  "應用程式 shell",
                                             "businessCapability":  "提供前端入口、共用版面、語系與樣式基礎。",
                                             "defaultSelected":  true,
                                             "dependencies":  [

                                                              ],
                                             "aliases":  [
                                                             "shell",
                                                             "layout",
                                                             "i18n"
                                                         ]
                                         },
                                         {
                                             "id":  "configuration-management",
                                             "displayName":  "設定管理",
                                             "businessCapability":  "集中管理環境設定與系統啟動設定。",
                                             "defaultSelected":  true,
                                             "dependencies":  [

                                                              ],
                                             "aliases":  [
                                                             "config",
                                                             "env"
                                                         ]
                                         },
                                         {
                                             "id":  "database-connection",
                                             "displayName":  "資料庫連線",
                                             "businessCapability":  "提供後端資料庫連線、session 與 migration 基礎。",
                                             "defaultSelected":  true,
                                             "dependencies":  [

                                                              ],
                                             "aliases":  [
                                                             "database",
                                                             "db"